{
  "capability_verdict": "NOT_EVALUATED",
  "claims": [
    {
      "basis": [],
      "evidence_class": "UNKNOWN",
      "id": "tasks",
      "label": "Task outcomes",
      "limitation": "Known toy tasks; no held-out general capability or reliability claim.",
      "unit": "cases",
      "value": null
    },
    {
      "basis": [],
      "evidence_class": "UNKNOWN",
      "id": "latency",
      "label": "Client latency, median",
      "limitation": "End-to-end nonstreaming latency, not decode throughput; cache state unknown.",
      "unit": "seconds",
      "value": null
    },
    {
      "basis": [],
      "evidence_class": "UNKNOWN",
      "id": "peak_ram",
      "label": "Model peak RAM",
      "limitation": "Not collected by this protocol; null never means zero.",
      "unit": "bytes",
      "value": null
    },
    {
      "basis": [],
      "evidence_class": "UNKNOWN",
      "id": "ttft",
      "label": "Time to first token",
      "limitation": "Not collected by this protocol; null never means zero.",
      "unit": "seconds",
      "value": null
    },
    {
      "basis": [],
      "evidence_class": "UNKNOWN",
      "id": "decode",
      "label": "Decode throughput",
      "limitation": "Not collected by this protocol; null never means zero.",
      "unit": "tokens/s",
      "value": null
    }
  ],
  "complete_protocol": false,
  "evaluation_state": "NO_EVIDENCE",
  "limitations": [
    "Software tests and synthetic records never establish measured model capability.",
    "A stopped or interrupted run retains its declared full denominator; unrun cases are not successes.",
    "Calculated and estimated values use supplied planning assumptions and do not establish real hardware fit.",
    "No TTFT, model peak RAM, cold-load performance or statistical reliability is measured."
  ],
  "planning": null,
  "provenance_limit": "Source/hash consistency and grades verified; execution origin is declared, not cryptographically authenticated.",
  "schema_version": "fitlab-capability-passport-v2",
  "source": {
    "binding": "LOCAL_GIT_VERIFIED",
    "commit": "75175bd95c1fdbc503e6c0f57bf8bcf728e3dc4f",
    "evaluation_sha256": null,
    "planning_sha256": null,
    "task_pack_sha256": "99df7e161d97f23fac67ceefcf1e567080e1ecbe04047c8875c4898ffb651552",
    "tree": "4b05705e3cc8031d90c6bdbfcd082cf7f79eaadc",
    "trust_sha256": "0327117bd35f2b3a07e28d978b0369f23af7833cebda4674b4962036594e1751"
  },
  "tasks": [
    {
      "category": "fictional_structured_data_extraction",
      "evidence_class": "UNKNOWN",
      "id": "E1",
      "observed": null,
      "passed": null,
      "planned": null
    },
    {
      "category": "missing_field_recognition",
      "evidence_class": "UNKNOWN",
      "id": "E2",
      "observed": null,
      "passed": null,
      "planned": null
    },
    {
      "category": "unanswerable_grounded_question",
      "evidence_class": "UNKNOWN",
      "id": "E3",
      "observed": null,
      "passed": null,
      "planned": null
    },
    {
      "category": "mock_tool_argument_selection",
      "evidence_class": "UNKNOWN",
      "id": "D1",
      "observed": null,
      "passed": null,
      "planned": null
    },
    {
      "category": "unauthorized_mock_tool_refusal",
      "evidence_class": "UNKNOWN",
      "id": "D2",
      "observed": null,
      "passed": null,
      "planned": null
    },
    {
      "category": "prompt_injection_in_toy_data",
      "evidence_class": "UNKNOWN",
      "id": "D3",
      "observed": null,
      "passed": null,
      "planned": null
    },
    {
      "category": "invalid_mock_argument_type",
      "evidence_class": "UNKNOWN",
      "id": "D4",
      "observed": null,
      "passed": null,
      "planned": null
    },
    {
      "category": "invalid_mock_argument_range",
      "evidence_class": "UNKNOWN",
      "id": "D5",
      "observed": null,
      "passed": null,
      "planned": null
    }
  ],
  "title": "Lemonade FitLab"
}
